[
  {
    "id": "SOL-001",
    "chain": "solidity",
    "title": "claimYieldFeeShares subtracts the full cached yieldFeeBalance instead of the claimed shares",
    "severity": "High",
    "category": "accounting",
    "status": "verified",
    "locations": [
      {
        "file": "src/PrizeVault.sol",
        "line_start": 611,
        "line_end": 622,
        "unit": "PrizeVault",
        "function": "claimYieldFeeShares"
      }
    ],
    "discovery": {
      "phase": "detect",
      "lens": "A",
      "mindset": "accountant",
      "consensus": "strong",
      "unit": null
    },
    "description": "Cross-function state consistency (lens A): yieldFeeBalance is a debt counter read by _totalDebt, totalYieldBalance, availableYieldBalance, liquidatableBalanceOf and transferTokensOut. Its only decrementing writer, claimYieldFeeShares, mints _shares but zeroes the whole balance. After a partial claim the unclaimed fee entitlement leaves totalDebt, so the backing assets become available yield and can be liquidated by the liquidation pair to the prize pool. The fee recipient permanently loses the remainder.",
    "root_cause": "`yieldFeeBalance -= _yieldFeeBalance` (cached full balance) instead of `-= _shares`.",
    "vulnerable_code": "yieldFeeBalance -= _yieldFeeBalance;\n\n_mint(msg.sender, _shares);",
    "recommendation": "Use `yieldFeeBalance -= _shares;`.",
    "harm": {
      "who": "yield fee recipient",
      "loses_what": "unclaimed fee shares left after a partial claim",
      "magnitude": "yieldFeeBalance - _shares per partial claim (e.g. 900 of 1000 fee shares lost to prize pool)"
    },
    "exploit_trace": [
      "1. Liquidations accrue yieldFeeBalance = 1000.",
      "2. yieldFeeRecipient calls claimYieldFeeShares(100): 100 shares minted, yieldFeeBalance set to 0.",
      "3. totalDebt drops by 900 relative to the correct value; 900 assets of backing are now counted as available yield.",
      "4. liquidationPair liquidates that yield; the recipient can never claim the remaining 900."
    ],
    "preconditions": [
      {
        "text": "yieldFeeBalance > 0 and recipient claims fewer shares than the balance",
        "type": "STATE"
      }
    ],
    "postconditions": [
      {
        "text": "yieldFeeBalance understated; fee entitlement lost",
        "type": "STATE"
      }
    ],
    "audit_trail": {
      "step_execution": "Gates: A=✓ B=✓ C=✓ D=✓ E=✓ F=✓ G=✓ H=✓",
      "rules_applied": [
        "R10:✓(claim of 1 share)"
      ],
      "depth_evidence": [
        "[TRACE:claim(100) with balance 1000 -> balance 0]",
        "[BOUNDARY:_shares==balance is the only correct case]"
      ],
      "missing_precondition": "",
      "postconditions_created": [
        "yieldFeeBalance understated"
      ],
      "who_benefits": "prize pool / liquidation pair takers"
    },
    "merged_from": [
      "DA-1",
      "DP1-1",
      "DB-1",
      "DC-1",
      "DD-1",
      "STATE-1"
    ],
    "verdict": {
      "gate": null,
      "reason": "Survived gates A-H. Read PrizeVault.sol claimYieldFeeShares (lines ~611-622): `yieldFeeBalance -= _yieldFeeBalance` subtracts the cached full balance while only _shares are minted; _totalDebt = totalSupply + yieldFeeBalance so totalDebt drops by (yieldFeeBalance - _shares) with no asset outflow, which flips to availableYieldBalance and is liquidatable via transferTokensOut. No other writer restores yieldFeeBalance; no guard prevents partial claim. Not in README/bot known issues. PoC recommended.",
      "evidence_tag": "[CODE-TRACE]",
      "method": "code-trace",
      "original_severity": null
    }
  }
]